page_title,page_url,content
AWS \ Amazon EC2 \ User Guide for Linux Instances \ What is Amazon EC2?,https://docs.aws.amazon.com/AWSEC2/latest/UserGuide/concepts.html,"^^^What is Amazon EC2?^^^ Amazon Elastic Compute Cloud (Amazon EC2) provides on-demand, scalable computing capacity in the Amazon Web Services (AWS) Cloud. Using Amazon EC2 reduces hardware costs so you can develop and deploy applications faster. You can use Amazon EC2 to launch as many or as few virtual servers as you need, configure security and networking, and manage storage. You can add capacity (scale up) to handle compute-heavy tasks, such as monthly or yearly processes, or spikes in website traffic. When usage decreases, you can reduce capacity (scale down) again. The following diagram shows a basic architecture of an Amazon EC2 instance deployed within an Amazon Virtual Private Cloud (VPC) In this example, the EC2 instance is within an Availability Zone in the Region. The EC2 instance is secured with a security group, which is a virtual firewall that controls incoming and outgoing traffic."
AWS \ Amazon EC2 \ User Guide for Linux Instances \ What is Amazon EC2?,https://docs.aws.amazon.com/AWSEC2/latest/UserGuide/concepts.html,"A private key is stored on the local computer and a public key is stored on the instance. Both keys are specified as a key pair to prove the identity of the user. In this scenario, the instance is backed by an Amazon EBS volume. The VPC communicates with the internet using an internet gateway. For more information about Amazon VPC, see the Amazon VPC User Guide. This user guide provides information specific to running Linux-based instances on Amazon EC2 See the EC2 User Guide for Windows Instances for information to help you run Windows-based instances on EC2 Amazon EC2 supports the processing, storage, and transmission of credit card data by a merchant or service provider, and has been validated as being compliant with Payment Card Industry (PCI) Data Security Standard (DSS) For more information about PCI DSS, including how to request a copy of the AWS PCI Compliance Package, see PCI DSS Level 1"
AWS \ Amazon EC2 \ User Guide for Linux Instances \ What is Amazon EC2?,https://docs.aws.amazon.com/AWSEC2/latest/UserGuide/concepts.html,"If you are looking for technical guidance about Amazon EC2, try AWS re:Post. For more information about cloud computing, see What is cloud computing? ^^Features of Amazon EC2^^ Amazon EC2 provides the following high-level features: Virtual servers. Preconfigured templates for your instances that package the components you need for your server (including the operating system and additional software) Various configurations of CPU, memory, storage, networking capacity, and graphics hardware for your instances. Secure login information for your instances. AWS stores the public key and you store the private key in a secure place. Storage volumes for temporary data that is deleted when you stop, hibernate, or terminate your instance. Persistent storage volumes for your data using Amazon Elastic Block Store (Amazon EBS) Multiple physical locations for your resources, such as instances and Amazon EBS volumes."
AWS \ Amazon EC2 \ User Guide for Linux Instances \ What is Amazon EC2?,https://docs.aws.amazon.com/AWSEC2/latest/UserGuide/concepts.html,"A virtual firewall that allows you to specify the protocols, ports, and source IP ranges that can reach your instances, and the destination IP ranges to which your instances can connect. Static IPv4 addresses for dynamic cloud computing. Metadata that you can create and assign to your Amazon EC2 resources. Virtual networks you can create that are logically isolated from the rest of the AWS Cloud. You can optionally connect these virtual networks to your own network. For details about all of the features of Amazon EC2, see Amazon EC2 features. For options to run your website on AWS, see Web Hosting. ^^Get started with Amazon EC2^^ The following topics can help you get started with Amazon EC2 After you set up to use EC2, you can walk through Tutorial: Get started with Amazon EC2 Linux instances to launch, connect to, and clean up an instance. The remaining topics point to more information about the high-level features of EC2 Set up to use Amazon EC2"
AWS \ Amazon EC2 \ User Guide for Linux Instances \ What is Amazon EC2?,https://docs.aws.amazon.com/AWSEC2/latest/UserGuide/concepts.html,"Tutorial: Get started with Amazon EC2 Linux instances. Connect to your Linux instance. Transfer files. Instances and AMIs. Regions and Zones. Instance types. Tags. Key pairs. Security groups. Elastic IP addresses. Virtual private clouds. Amazon EBS. Instance store. Remotely Run Commands on an EC2 Instance with AWS Systems Manager. Install LAMP on Amazon Linux 2023 Configure SSL/TLS on Amazon Linux 2023 Host a WordPress blog. Troubleshoot EC2 instances. AWS re:Post. ^^Related services^^ You can provision Amazon EC2 resources, such as instances and volumes, directly using Amazon EC2 In addition, you can provision EC2 resources using other AWS services, such as the following: Amazon EC2 Auto Scaling. Helps ensure you have the correct number of Amazon EC2 instances available to handle the load for your application. AWS CloudFormation. Helps you model and set up your AWS resources using templates. AWS Elastic Beanstalk."
AWS \ Amazon EC2 \ User Guide for Linux Instances \ What is Amazon EC2?,https://docs.aws.amazon.com/AWSEC2/latest/UserGuide/concepts.html,"Deploy and manage applications in the AWS Cloud without having to understand the underlying infrastructure. AWS OpsWorks. Automate how servers are configured, deployed, and managed across your Amazon EC2 instances using Chef and Puppet. EC2 Image Builder. Automate the creation, management, and deployment of customized, secure, and up-to-date server images. AWS Launch Wizard. Size, configure, and deploy AWS resources for third-party applications without having to manually identify and provision individual AWS resources. Amazon Lightsail. To build websites or web applications, you can deploy and manage basic cloud resources using Amazon Lightsail. To compare the features of Amazon EC2 and Lightsail for your use case, see Amazon Lightsail or Amazon EC2 Elastic Load Balancing. Automatically distribute incoming application traffic across multiple instances. Amazon Relational Database Service (Amazon RDS) Set up, operate, and scale a managed relational database in the cloud."
AWS \ Amazon EC2 \ User Guide for Linux Instances \ What is Amazon EC2?,https://docs.aws.amazon.com/AWSEC2/latest/UserGuide/concepts.html,"Although you can set up a database on an EC2 instance, Amazon RDS offers the advantage of handling your database management tasks, such as patching the software, backing up, and storing the backups. Amazon Elastic Container Service (Amazon ECS) Deploy, manage, and scale containerized applications on a cluster of EC2 instances. Amazon CloudWatch. Monitor your instances and Amazon EBS volumes. Amazon GuardDuty. Detect potentially unauthorized or malicious use of your EC2 instances. AWS Backup. Automate backing up your Amazon EC2 instances and the Amazon EBS volumes attached to them. ^^Access Amazon EC2^^ You can create and manage your Amazon EC2 instances using the following interfaces: A simple web interface to create and manage Amazon EC2 instances and resources. If you've signed up for an AWS account, you can access the Amazon EC2 console by signing into the AWS Management Console and selecting EC2 from the console home page."
AWS \ Amazon EC2 \ User Guide for Linux Instances \ What is Amazon EC2?,https://docs.aws.amazon.com/AWSEC2/latest/UserGuide/concepts.html,"Enables you to interact with AWS services using commands in your command-line shell. It is supported on Windows, Mac, and Linux. For more information about the AWS CLI , see AWS Command Line Interface User Guide. You can find the Amazon EC2 commands in the AWS CLI Command Reference. A set of PowerShell modules that are built on the functionality exposed by the AWS SDK for .NET. The Tools for PowerShell enable you to script operations on your AWS resources from the PowerShell command line. To get started, see the AWS Tools for Windows PowerShell User Guide. You can find the cmdlets for Amazon EC2, in the AWS Tools for PowerShell Cmdlet Reference. Amazon EC2 supports creating resources using AWS CloudFormation. You create a template, in JSON or YAML format, that describes your AWS resources, and AWS CloudFormation provisions and configures those resources for you."
AWS \ Amazon EC2 \ User Guide for Linux Instances \ What is Amazon EC2?,https://docs.aws.amazon.com/AWSEC2/latest/UserGuide/concepts.html,"You can reuse your CloudFormation templates to provision the same resources multiple times, whether in the same Region and account or in multiple Regions and accounts. For more information about supported resource types and properties for Amazon EC2, see EC2 resource type reference in the AWS CloudFormation User Guide. Amazon EC2 provides a Query API. These requests are HTTP or HTTPS requests that use the HTTP verbs GET or POST and a Query parameter named Action. For more information about the API actions for Amazon EC2, see Actions in the Amazon EC2 API Reference. If you prefer to build applications using language-specific APIs instead of submitting a request over HTTP or HTTPS, AWS provides libraries, sample code, tutorials, and other resources for software developers. These libraries provide basic functions that automate tasks such as cryptographically signing your requests, retrying requests, and handling error responses, making it easier for you to get started. For more information, see Tools to Build on AWS. ^^Pricing for Amazon EC2^^"
AWS \ Amazon EC2 \ User Guide for Linux Instances \ What is Amazon EC2?,https://docs.aws.amazon.com/AWSEC2/latest/UserGuide/concepts.html,"Amazon EC2 provides the following pricing options: You can get started with Amazon EC2 for free. To explore the Free Tier options, see AWS Free Tier. Pay for the instances that you use by the second, with a minimum of 60 seconds, with no long-term commitments or upfront payments. You can reduce your Amazon EC2 costs by making a commitment to a consistent amount of usage, in USD per hour, for a term of 1 or 3 years. You can reduce your Amazon EC2 costs by making a commitment to a specific instance configuration, including instance type and Region, for a term of 1 or 3 years. Request unused EC2 instances, which can reduce your Amazon EC2 costs significantly. Reduce costs by using a physical EC2 server that is fully dedicated for your use, either On-Demand or as part of a Savings Plan. You can use your existing server-bound software licenses and get help meeting compliance requirements."
AWS \ Amazon EC2 \ User Guide for Linux Instances \ What is Amazon EC2?,https://docs.aws.amazon.com/AWSEC2/latest/UserGuide/concepts.html,"Reserve compute capacity for your EC2 instances in a specific Availability Zone for any duration of time. Removes the cost of unused minutes and seconds from your bill. For a complete list of charges and prices for Amazon EC2 and more information about the purchase models, see Amazon EC2 pricing. ^Estimates, billing, and cost optimization^ To create estimates for your AWS use cases, use the AWS Pricing Calculator. To see your bill, go to the Billing and Cost Management Dashboard in the AWS Billing and Cost Management console. Your bill contains links to usage reports that provide details about your bill. To learn more about AWS account billing, see AWS Billing and Cost Management User Guide. If you have questions concerning AWS billing, accounts, and events, contact AWS Support. To calculate the cost of a sample provisioned environment, see Cloud Economics Center. When calculating the cost of a provisioned environment, remember to include incidental costs such as snapshot storage for EBS volumes.You can optimize the cost, security, and performance of your AWS environment using AWS Trusted Advisor."
AWS \ Amazon EC2 \ User Guide for Windows Instances \ What is Amazon EC2?,https://docs.aws.amazon.com/AWSEC2/latest/WindowsGuide/index.html,"^^^What is Amazon EC2?^^^ Amazon Elastic Compute Cloud (Amazon EC2) provides on-demand, scalable computing capacity in the Amazon Web Services (AWS) Cloud. Using Amazon EC2 reduces hardware costs so you can develop and deploy applications faster. You can use Amazon EC2 to launch as many or as few virtual servers as you need, configure security and networking, and manage storage. You can add capacity (scale up) to handle compute-heavy tasks, such as monthly or yearly processes, or spikes in website traffic. When usage decreases, you can reduce capacity (scale down) again. The following diagram shows a basic architecture of an Amazon EC2 instance deployed within an Amazon Virtual Private Cloud (VPC) In this example, the EC2 instance is within an Availability Zone in the Region. The EC2 instance is secured with a security group, which is a virtual firewall that controls incoming and outgoing traffic."
AWS \ Amazon EC2 \ User Guide for Windows Instances \ What is Amazon EC2?,https://docs.aws.amazon.com/AWSEC2/latest/WindowsGuide/index.html,"A private key is stored on the local computer and a public key is stored on the instance. Both keys are specified as a key pair to prove the identity of the user. In this scenario, the instance is backed by an Amazon EBS volume. The VPC communicates with the internet using an internet gateway. For more information about Amazon VPC, see the Amazon VPC User Guide. This user guide provides information specific to running Windows-based instances on Amazon EC2 See the EC2 User Guide for Linux Instances for information to help you run Linux-based instances on EC2 Amazon EC2 supports the processing, storage, and transmission of credit card data by a merchant or service provider, and has been validated as being compliant with Payment Card Industry (PCI) Data Security Standard (DSS) For more information about PCI DSS, including how to request a copy of the AWS PCI Compliance Package, see PCI DSS Level 1"
AWS \ Amazon EC2 \ User Guide for Windows Instances \ What is Amazon EC2?,https://docs.aws.amazon.com/AWSEC2/latest/WindowsGuide/index.html,"If you are looking for technical guidance about Amazon EC2, try AWS re:Post. For more information about cloud computing, see What is cloud computing? ^^Features of Amazon EC2^^ Amazon EC2 provides the following high-level features: Virtual servers. Preconfigured templates for your instances that package the components you need for your server (including the operating system and additional software) Various configurations of CPU, memory, storage, networking capacity, and graphics hardware for your instances. Secure login information for your instances. AWS stores the public key and you store the private key in a secure place. Storage volumes for temporary data that is deleted when you stop, hibernate, or terminate your instance. Persistent storage volumes for your data using Amazon Elastic Block Store (Amazon EBS) Multiple physical locations for your resources, such as instances and Amazon EBS volumes."
AWS \ Amazon EC2 \ User Guide for Windows Instances \ What is Amazon EC2?,https://docs.aws.amazon.com/AWSEC2/latest/WindowsGuide/index.html,"A virtual firewall that allows you to specify the protocols, ports, and source IP ranges that can reach your instances, and the destination IP ranges to which your instances can connect. Static IPv4 addresses for dynamic cloud computing. Metadata that you can create and assign to your Amazon EC2 resources. Virtual networks you can create that are logically isolated from the rest of the AWS Cloud. You can optionally connect these virtual networks to your own network. For details about all of the features of Amazon EC2, see Amazon EC2 features. Windows-specific features and use case information can be found at Windows Server on AWS. For options to run your website on AWS, see Web Hosting. ^^Get started with Amazon EC2^^ The following topics can help you get started with Amazon EC2 After you set up to use EC2, you can walk through Tutorial: Get started with Amazon EC2 Windows instances to launch, connect to, and clean up an instance."
AWS \ Amazon EC2 \ User Guide for Windows Instances \ What is Amazon EC2?,https://docs.aws.amazon.com/AWSEC2/latest/WindowsGuide/index.html,"The remaining topics point to more information about the high-level features of EC2 Set up to use Amazon EC2 Tutorial: Get started with Amazon EC2 Windows instances. Connect to your Windows instance. Transfer files to Windows instances. Amazon EC2 Windows instances. Instance types. Tags. Key pairs. Security groups. Elastic IP addresses. Virtual private clouds. Amazon EBS. Instance store. AWS Systems Manager Run Command in the AWS Systems Manager User Guide. Tutorial: Get started with Amazon EC2 Windows instances. Troubleshoot EC2 Windows instances. AWS re:Post. ^^Related services^^ You can provision Amazon EC2 resources, such as instances and volumes, directly using Amazon EC2 In addition, you can provision EC2 resources using other AWS services, such as the following: Amazon EC2 Auto Scaling. Helps ensure you have the correct number of Amazon EC2 instances available to handle the load for your application. AWS CloudFormation. Helps you model and set up your AWS resources using templates."
AWS \ Amazon EC2 \ User Guide for Windows Instances \ What is Amazon EC2?,https://docs.aws.amazon.com/AWSEC2/latest/WindowsGuide/index.html,"AWS Elastic Beanstalk. Deploy and manage applications in the AWS Cloud without having to understand the underlying infrastructure. AWS OpsWorks. Automate how servers are configured, deployed, and managed across your Amazon EC2 instances using Chef and Puppet. EC2 Image Builder. Automate the creation, management, and deployment of customized, secure, and up-to-date server images. AWS Launch Wizard. Size, configure, and deploy AWS resources for third-party applications without having to manually identify and provision individual AWS resources. Amazon Lightsail. To build websites or web applications, you can deploy and manage basic cloud resources using Amazon Lightsail. To compare the features of Amazon EC2 and Lightsail for your use case, see Amazon Lightsail or Amazon EC2 Elastic Load Balancing. Automatically distribute incoming application traffic across multiple instances. Amazon Relational Database Service (Amazon RDS) Set up, operate, and scale a managed relational database in the cloud."
AWS \ Amazon EC2 \ User Guide for Windows Instances \ What is Amazon EC2?,https://docs.aws.amazon.com/AWSEC2/latest/WindowsGuide/index.html,"Although you can set up a database on an EC2 instance, Amazon RDS offers the advantage of handling your database management tasks, such as patching the software, backing up, and storing the backups. Amazon Elastic Container Service (Amazon ECS) Deploy, manage, and scale containerized applications on a cluster of EC2 instances. Amazon CloudWatch. Monitor your instances and Amazon EBS volumes. Amazon GuardDuty. Detect potentially unauthorized or malicious use of your EC2 instances. AWS Backup. Automate backing up your Amazon EC2 instances and the Amazon EBS volumes attached to them. ^^Access Amazon EC2^^ You can create and manage your Amazon EC2 instances using the following interfaces: A simple web interface to create and manage Amazon EC2 instances and resources. If you've signed up for an AWS account, you can access the Amazon EC2 console by signing into the AWS Management Console and selecting EC2 from the console home page."
AWS \ Amazon EC2 \ User Guide for Windows Instances \ What is Amazon EC2?,https://docs.aws.amazon.com/AWSEC2/latest/WindowsGuide/index.html,"Enables you to interact with AWS services using commands in your command-line shell. It is supported on Windows, Mac, and Linux. For more information about the AWS CLI , see AWS Command Line Interface User Guide. You can find the Amazon EC2 commands in the AWS CLI Command Reference. A set of PowerShell modules that are built on the functionality exposed by the AWS SDK for .NET. The Tools for PowerShell enable you to script operations on your AWS resources from the PowerShell command line. To get started, see the AWS Tools for Windows PowerShell User Guide. You can find the cmdlets for Amazon EC2, in the AWS Tools for PowerShell Cmdlet Reference. Amazon EC2 supports creating resources using AWS CloudFormation. You create a template, in JSON or YAML format, that describes your AWS resources, and AWS CloudFormation provisions and configures those resources for you."
AWS \ Amazon EC2 \ User Guide for Windows Instances \ What is Amazon EC2?,https://docs.aws.amazon.com/AWSEC2/latest/WindowsGuide/index.html,"You can reuse your CloudFormation templates to provision the same resources multiple times, whether in the same Region and account or in multiple Regions and accounts. For more information about supported resource types and properties for Amazon EC2, see EC2 resource type reference in the AWS CloudFormation User Guide. Amazon EC2 provides a Query API. These requests are HTTP or HTTPS requests that use the HTTP verbs GET or POST and a Query parameter named Action. For more information about the API actions for Amazon EC2, see Actions in the Amazon EC2 API Reference. If you prefer to build applications using language-specific APIs instead of submitting a request over HTTP or HTTPS, AWS provides libraries, sample code, tutorials, and other resources for software developers. These libraries provide basic functions that automate tasks such as cryptographically signing your requests, retrying requests, and handling error responses, making it easier for you to get started. For more information, see Tools to Build on AWS. ^^Pricing for Amazon EC2^^"
AWS \ Amazon EC2 \ User Guide for Windows Instances \ What is Amazon EC2?,https://docs.aws.amazon.com/AWSEC2/latest/WindowsGuide/index.html,"Amazon EC2 provides the following pricing options: You can get started with Amazon EC2 for free. To explore the Free Tier options, see AWS Free Tier. Pay for the instances that you use by the second, with a minimum of 60 seconds, with no long-term commitments or upfront payments. You can reduce your Amazon EC2 costs by making a commitment to a consistent amount of usage, in USD per hour, for a term of 1 or 3 years. You can reduce your Amazon EC2 costs by making a commitment to a specific instance configuration, including instance type and Region, for a term of 1 or 3 years. Request unused EC2 instances, which can reduce your Amazon EC2 costs significantly. Reduce costs by using a physical EC2 server that is fully dedicated for your use, either On-Demand or as part of a Savings Plan. You can use your existing server-bound software licenses and get help meeting compliance requirements."
AWS \ Amazon EC2 \ User Guide for Windows Instances \ What is Amazon EC2?,https://docs.aws.amazon.com/AWSEC2/latest/WindowsGuide/index.html,"Reserve compute capacity for your EC2 instances in a specific Availability Zone for any duration of time. Removes the cost of unused minutes and seconds from your bill. For a complete list of charges and prices for Amazon EC2 and more information about the purchase models, see Amazon EC2 pricing. ^Estimates, billing, and cost optimization^ To create estimates for your AWS use cases, use the AWS Pricing Calculator. To estimate the cost of transforming Microsoft workloads to a modern architecture that uses open source and cloud-native services deployed on AWS, use the AWS Modernization Calculator for Microsoft Workloads. To see your bill, go to the Billing and Cost Management Dashboard in the AWS Billing and Cost Management console. Your bill contains links to usage reports that provide details about your bill. To learn more about AWS account billing, see AWS Billing and Cost Management User Guide. If you have questions concerning AWS billing, accounts, and events, contact AWS Support.To calculate the cost of a sample provisioned environment, see Cloud Economics Center. When calculating the cost of a provisioned environment, remember to include incidental costs such as snapshot storage for EBS volumes. You can optimize the cost, security, and performance of your AWS environment using AWS Trusted Advisor."
AWS \ Amazon Simple Storage Service (S3) \ User Guide \ What is Amazon S3?,https://docs.aws.amazon.com/AmazonS3/latest/userguide/index.html,"^^^What is Amazon S3?^^^ Amazon Simple Storage Service (Amazon S3) is an object storage service that offers industry-leading scalability, data availability, security, and performance. Customers of all sizes and industries can use Amazon S3 to store and protect any amount of data for a range of use cases, such as data lakes, websites, mobile applications, backup and restore, archive, enterprise applications, IoT devices, and big data analytics. Amazon S3 provides management features so that you can optimize, organize, and configure access to your data to meet your specific business, organizational, and compliance requirements. ^^Features of Amazon S3^^ ^Storage classes^ Amazon S3 offers a range of storage classes designed for different use cases."
