page_title,page_url,content
AWS \ AWS Lambda \ Developer Guide \ API reference,https://docs.aws.amazon.com/lambda/latest/dg/API_Reference.html,"Java 1.4.2_12 (May 2006), 5 Update 2 (March 2005), and all later versions, including Java 6 (December 2006), 7, and 8, contain at least one of the required CAs in their default trusted CA list. When accessing the AWS Lambda management console or AWS Lambda API endpoints, whether through browsers or programmatically, you will need to ensure your client machines support any of the following CAs: Amazon Root CA 1 Starfield Services Root Certificate Authority - G2 Starfield Class 2 Certification Authority. Root certificates from the first two authorities are available from Amazon trust services, but keeping your computer up-to-date is the more straightforward solution. To learn more about ACM-provided certificates, see AWS Certificate Manager FAQs."
AWS \ AWS Lambda \ Operator Guide \ Introduction,https://docs.aws.amazon.com/lambda/latest/operatorguide/intro.html,"^^^Introduction^^^ AWS Lambda is a flexible service designed for a wide variety of use-cases. Across the millions of AWS customers using Lambda every month, serverless applications generally fall into several common categories: Web applications: serve the front-end code via Amazon S3 and Amazon CloudFront, or automating the entire deployment and hosting with AWS Amplify Console. Web and mobile backends: the front-ends interact with the backend via API Gateway. Integrated authorization and authentication are provided by Amazon Cognito or APN Partners like Auth0 Data processing: event-based processing tasks triggered by data changes in data stores, or streaming data ETL tasks with Amazon Kinesis and Lambda. Parallelized computing tasks: splitting highly complex, long-lived computations to individual tasks across many Lambda function instances to process data more quickly in parallel. Internet of Things (IoT) workloads: processing data generated by physical IoT devices."
AWS \ AWS Lambda \ Operator Guide \ Introduction,https://docs.aws.amazon.com/lambda/latest/operatorguide/intro.html,"Additionally, many workloads are hybrid serverless applications, especially where legacy systems are being migrated from either on-premises or instance-based environments. In this case, developers can gradually migrate functionality from a legacy system to a Lambda-based application. This guide is built for developers and operators of Lambda-based applications. It is aimed at operators of typical production serverless applications, looking to understand more clearly how to build, measure, troubleshoot, and optimize their compute processes. This guide covers concepts and best practices for designing Lambda-based applications, together with an approach for ongoing monitoring and troubleshooting. Serverless applications can include a wide variety of different AWS services to manage APIs, messaging, storage, and content distribution. Most of these applications rely upon Lambda for connecting these services and transforming the data throughout an application. This guide focuses on the role of Lambda in these architectures, and how you can fine-tune your functions and their configurations to maximize reliability and maintainability, and reduce cost."
AWS \ AWS Lambda \ Operator Guide \ Introduction,https://docs.aws.amazon.com/lambda/latest/operatorguide/intro.html,"Lambda-based applications are event-driven architectures with many of the characteristics of distributed systems. While Lambda handles many of the complex tasks like scaling and infrastructure management, it’s important for operators to understand the scope of knowledge that they need to manage serverless applications successfully. As AWS customers adopt Lambda to solve many of their most challenging workloads, understanding the troubleshooting and monitoring tasks involved is the key to becoming a proficient operator. Both start-ups and enterprises develop Lambda-based applications for green field applications and legacy applications. As these applications develop features and build traffic, many of the same best practices for operations apply. This guide covers many of the most important operational best practices and advice while explaining core topics underpinning how Lambda-based applications work. The first half of this guide provides a deep dive into foundational topics around event-driven architectures, application design, and security. The latter half covers guidance for operators around debugging, monitoring and observability, and performance optimization."
AWS \ AWS Lambda \ Operator Guide \ Introduction,https://docs.aws.amazon.com/lambda/latest/operatorguide/intro.html,"The goal is to provide a concrete, actionable approach to operating and troubleshooting Lambda-based applications. These are the topics covered in detail: Event-driven architectures: understanding how events drive serverless applications informs the design of your workload. This chapter explains: how Lambda fits into this paradigm; the benefits and tradeoffs of event-driven architectures; design principles, stateless design, idempotency, and message ordering; retry behaviors; using AWS services; avoiding common anti-patterns. Application design: topics include: understanding quotas; scaling and concurrency; choosing and managing runtimes and SDKs; networking and VPC configurations; comparing synchronous versus asynchronous invocations; controlling traffic flow for non-serverless services. Security: security is the primary concern at AWS, but all developers have a role to play in developing secure applications. This covers: the shared responsibility model; applying the principles of least privilege; handling sensitive data; IAM roles and resource policies; authorization and authentication; code signing; protecting applications with public endpoints."
AWS \ AWS Lambda \ Operator Guide \ Introduction,https://docs.aws.amazon.com/lambda/latest/operatorguide/intro.html,"Debugging: the process of identifying errors in software is critical to any production workload. Topics include: standardizing a debugging approach; capturing and replaying events; troubleshooting executions, networking, and deployments; identifying common causes of errors (memory configurations, timeouts, quotas, third-party libraries, and unintended leakage between invocations) Monitoring and observability: serverless applications have parallels with distributed applications for monitoring and observability, presenting challenges to new serverless operators. This chapter explains: instrumentation best practices; CloudWatch Logs (using Insights and AWS Resource Groups); tracing with X-Ray; alerts and automation; code storage optimization. Performance optimization: while Lambda manages running and scaling functions, there are many levers available to developers that influence the performance. Topics include: cold starts and latency, package sizes and dependencies, memory and power settings; performance and cost; maximizing throughput. This guide will be revised regularly to incorporate new Lambda features and AWS services as they are released.If you have any questions or comments about any of the content in this guide, raise an issue in the GitHub repository or contact the author. James Beswick AWS Serverless Developer Advocate jbeswick@amazon.com."
AWS \ Amazon VPC \ User Guide \ What is Amazon VPC?,https://docs.aws.amazon.com/vpc/latest/userguide/index.html,"^^^What is Amazon VPC?^^^ With Amazon Virtual Private Cloud (Amazon VPC), you can launch AWS resources in a logically isolated virtual network that you've defined. This virtual network closely resembles a traditional network that you'd operate in your own data center, with the benefits of using the scalable infrastructure of AWS. The following diagram shows an example VPC. The VPC has one subnet in each of the Availability Zones in the Region, EC2 instances in each subnet, and an internet gateway to allow communication between the resources in your VPC and the internet. For more information, see Amazon Virtual Private Cloud (Amazon VPC) ^^Features^^ The following features help you configure a VPC to provide the connectivity that your applications need: A VPC is a virtual network that closely resembles a traditional network that you'd operate in your own data center. After you create a VPC, you can add subnets. A subnet is a range of IP addresses in your VPC."
AWS \ Amazon VPC \ User Guide \ What is Amazon VPC?,https://docs.aws.amazon.com/vpc/latest/userguide/index.html,"A subnet must reside in a single Availability Zone. After you add subnets, you can deploy AWS resources in your VPC. You can assign IP addresses, both IPv4 and IPv6, to your VPCs and subnets. You can also bring your public IPv4 and IPv6 GUA addresses to AWS and allocate them to resources in your VPC, such as EC2 instances, NAT gateways, and Network Load Balancers. Use route tables to determine where network traffic from your subnet or gateway is directed. A gateway connects your VPC to another network. For example, use an internet gateway to connect your VPC to the internet. Use a VPC endpoint to connect to AWS services privately, without the use of an internet gateway or NAT device. Use a VPC peering connection to route traffic between the resources in two VPCs. Copy network traffic from network interfaces and send it to security and monitoring appliances for deep packet inspection."
AWS \ Amazon VPC \ User Guide \ What is Amazon VPC?,https://docs.aws.amazon.com/vpc/latest/userguide/index.html,"Use a transit gateway, which acts as a central hub, to route traffic between your VPCs, VPN connections, and AWS Direct Connect connections. A flow log captures information about the IP traffic going to and from network interfaces in your VPC. Connect your VPCs to your on-premises networks using AWS Virtual Private Network (AWS VPN) ^^Getting started with Amazon VPC^^ Your AWS account includes a default VPC in each AWS Region. Your default VPCs are configured such that you can immediately start launching and connecting to EC2 instances. For more information, see Get started with Amazon VPC. You can choose to create additional VPCs with the subnets, IP addresses, gateways and routing that you need. For more information, see Create a VPC. ^^Working with Amazon VPC^^ You can create and manage your VPCs using any of the following interfaces:"
AWS \ Amazon VPC \ User Guide \ What is Amazon VPC?,https://docs.aws.amazon.com/vpc/latest/userguide/index.html,"AWS Management Console — Provides a web interface that you can use to access your VPCs. AWS Command Line Interface (AWS CLI) — Provides commands for a broad set of AWS services, including Amazon VPC, and is supported on Windows, Mac, and Linux. For more information, see AWS Command Line Interface. AWS SDKs — Provides language-specific APIs and takes care of many of the connection details, such as calculating signatures, handling request retries, and error handling. For more information, see AWS SDKs. Query API — Provides low-level API actions that you call using HTTPS requests. Using the Query API is the most direct way to access Amazon VPC, but it requires that your application handle low-level details such as generating the hash to sign the request, and error handling. For more information, see Amazon VPC actions in the Amazon EC2 API Reference. ^^Pricing for Amazon VPC^^ There's no additional charge for using a VPC."
AWS \ Amazon VPC \ User Guide \ What is Amazon VPC?,https://docs.aws.amazon.com/vpc/latest/userguide/index.html,"There are charges for some VPC components, such as NAT gateways, IP Address Manager, traffic mirroring, Reachability Analyzer, and Network Access Analyzer. For more information, see Amazon VPC Pricing. Pricing for public IPv4 addresses. Public IPv4 addresses are charged. For specific pricing information, see the Public IPv4 address tab in Amazon VPC Pricing. Private IPv4 addresses (RFC 1918) are not charged. Nearly all resources you launch in your VPC come with an IP address for connectivity. While the vast majority of resources in your VPC use private IPv4 addresses, resources that require direct access to the internet over IPv4 use public IPv4 addresses. A public IPv4 address is an IPv4 address that is routable from the internet. A public IPv4 address is necessary for a resource to be directly reachable from the internet over IPv4 The types of public IPv4 addresses are:"
AWS \ Amazon VPC \ User Guide \ What is Amazon VPC?,https://docs.aws.amazon.com/vpc/latest/userguide/index.html,"Elastic IP addresses (EIPs): Static, public IPv4 addresses provided by Amazon that you can associate with an EC2 instance, elastic network interface, or AWS resource. EC2 public IPv4 addresses: Public IPv4 addresses assigned to an EC2 instance by Amazon (if the EC2 instance is launched into a default subnet or if the instance is launched into a subnet that’s been configured to automatically assign a public IPv4 address) BYOIPv4 addresses: Public IPv4 addresses in the IPv4 address range that you’ve brought to AWS using Bring your own IP addresses (BYOIP) Service-managed IPv4 addresses: Public IPv4 addresses automatically provisioned on AWS resources and managed by an AWS service. For example, public IPv4 addresses on Amazon ECS, Amazon RDS, or Amazon Workspaces. Below is a list of most common AWS services that can use public IPv4 addresses. Amazon AppStream 2.0 AWS Database Migration Service. Amazon EC2"
AWS \ Amazon VPC \ User Guide \ What is Amazon VPC?,https://docs.aws.amazon.com/vpc/latest/userguide/index.html,Amazon Elastic Container Service. Amazon EKS. Amazon EMR. AWS Global Accelerator. AWS Mainframe Modernization. Amazon Managed Streaming for Apache Kafka. Amazon MQ. Amazon RDS. Amazon Redshift. AWS Site-to-Site VPN. Amazon VPC NAT gateway. Amazon WorkSpaces. Elastic Load Balancing.
AWS \ Amazon VPC \ VPC Peering \ What is VPC peering?,https://docs.aws.amazon.com/vpc/latest/peering/index.html,"^^^What is VPC peering?^^^ A virtual private cloud (VPC) is a virtual network dedicated to your AWS account. It is logically isolated from other virtual networks in the AWS Cloud. You can launch AWS resources, such as Amazon EC2 instances, into your VPC. A VPC peering connection is a networking connection between two VPCs that enables you to route traffic between them using private IPv4 addresses or IPv6 addresses. Instances in either VPC can communicate with each other as if they are within the same network. You can create a VPC peering connection between your own VPCs, or with a VPC in another AWS account. The VPCs can be in different Regions (also known as an inter-Region VPC peering connection)"
AWS \ Amazon VPC \ VPC Peering \ What is VPC peering?,https://docs.aws.amazon.com/vpc/latest/peering/index.html,"AWS uses the existing infrastructure of a VPC to create a VPC peering connection; it is neither a gateway nor a VPN connection, and does not rely on a separate piece of physical hardware. There is no single point of failure for communication or a bandwidth bottleneck. A VPC peering connection helps you to facilitate the transfer of data. For example, if you have more than one AWS account, you can peer the VPCs across those accounts to create a file sharing network. You can also use a VPC peering connection to allow other VPCs to access resources you have in one of your VPCs. When you establish peering relationships between VPCs across different AWS Regions, resources in the VPCs (for example, EC2 instances and Lambda functions) in different AWS Regions can communicate with each other using private IP addresses, without using a gateway, VPN connection, or network appliance. The traffic remains in the private IP space."
AWS \ Amazon VPC \ VPC Peering \ What is VPC peering?,https://docs.aws.amazon.com/vpc/latest/peering/index.html,"All inter-Region traffic is encrypted with no single point of failure, or bandwidth bottleneck. Traffic always stays on the global AWS backbone, and never traverses the public internet, which reduces threats, such as common exploits, and DDoS attacks. Inter-Region VPC peering provides a simple and cost-effective way to share resources between regions or replicate data for geographic redundancy. ^^Pricing for a VPC peering connection^^ There is no charge to create a VPC peering connection. All data transfer over a VPC Peering connection that stays within an Availability Zone (AZ) is free. Charges apply for data transfer over a VPC Peering connections that cross Availability Zones and Regions. For more information, see Amazon EC2 Pricing."
AWS \ Amazon VPC \ Traffic Mirroring \ What is Traffic Mirroring?,https://docs.aws.amazon.com/vpc/latest/mirroring/index.html,"^^^What is Traffic Mirroring?^^^ Traffic Mirroring is an Amazon VPC feature that you can use to copy network traffic from an elastic network interface of type interface. You can then send the traffic to out-of-band security and monitoring appliances for: Content inspection. Threat monitoring. Troubleshooting. The security and monitoring appliances can be deployed as individual instances, or as a fleet of instances behind either a Network Load Balancer or a Gateway Load Balancer with a UDP listener. Traffic Mirroring supports filters and packet truncation, so that you can extract only the traffic of interest, using the monitoring tools of your choice. ^^Traffic Mirroring concepts^^ The following are the key concepts for Traffic Mirroring: Source — The network interface to monitor. Filter — A set of rules that defines the traffic that is mirrored. Target — The destination for mirrored traffic. Session — Establishes a relationship between a source, a filter, and a target. ^^Work with Traffic Mirroring^^"
AWS \ Amazon VPC \ Traffic Mirroring \ What is Traffic Mirroring?,https://docs.aws.amazon.com/vpc/latest/mirroring/index.html,"You can create, access, and manage your traffic mirror resources using any of the following: AWS Management Console— Provides a web interface that you can use to access your traffic mirror resources. AWS Command Line Interface (AWS CLI) — Provides commands for a broad set of AWS services, including Amazon VPC. The AWS CLI is supported on Windows, macOS, and Linux. For more information, see AWS Command Line Interface. AWS SDKs — Provide language-specific APIs. The AWS SDKs take care of many of the connection details, such as calculating signatures, handling request retries, and handling errors. For more information, see AWS SDKs. Query API— Provides low-level API actions that you call using HTTPS requests. Using the Query API is the most direct way to access Amazon VPC. However, it requires that your application handle low-level details such as generating the hash to sign the request and handling errors. For more information, see Amazon VPC actions in the Amazon EC2 API Reference."
AWS \ Amazon VPC \ Traffic Mirroring \ What is Traffic Mirroring?,https://docs.aws.amazon.com/vpc/latest/mirroring/index.html,"^^Traffic Mirroring benefits^^ Traffic Mirroring offers the following benefits: Simplified operation — Mirror any range of your VPC traffic without having to manage packet forwarding agents on your EC2 instances. Enhanced security — Capture packets at the elastic network interface, which cannot be disabled or tampered with from a user space. Increased monitoring options — Send your mirrored traffic to any security device. ^^Pricing^^ You are charged on an hourly basis for each active traffic mirror session. You'll continue to be charged for Traffic Mirroring until you delete all active traffic mirror sessions. For example, you'll still be charged in the following scenarios: You detached the network interface from the mirror source. You stopped or terminated the mirror source. You changed the instance type of the mirror source to an unsupported instance type. For the steps to delete a traffic mirror session, see Delete a traffic mirror session. For information about pricing for Traffic Mirroring, see Network Analysis on the Amazon VPC pricing page."
AWS \ Amazon EC2 \ API Reference \ Actions by service \ Amazon VPC actions,https://docs.aws.amazon.com/AWSEC2/latest/APIReference/OperationList-query-vpc.html,"^^^Amazon VPC actions^^^ The following API actions are available for Amazon VPC. To learn more about Amazon VPC, see the Amazon VPC product page and the Amazon VPC documentation. AssociateDhcpOptions. CreateDhcpOptions. DeleteDhcpOptions. DescribeDhcpOptions. AssignIpv6Addresses. AssignPrivateIpAddresses. AttachNetworkInterface. CreateNetworkInterface. CreateNetworkInterfacePermission. DeleteNetworkInterface. DeleteNetworkInterfacePermission. DescribeNetworkInterfaceAttribute. DescribeNetworkInterfacePermissions. DescribeNetworkInterfaces. DetachNetworkInterface. ModifyNetworkInterfaceAttribute. ResetNetworkInterfaceAttribute. UnassignIpv6Addresses. UnassignPrivateIpAddresses. AttachInternetGateway. CreateEgressOnlyInternetGateway. CreateInternetGateway. DeleteEgressOnlyInternetGateway. DeleteInternetGateway. DescribeEgressOnlyInternetGateways. DescribeInternetGateways. DetachInternetGateway. CreateManagedPrefixList. DeleteManagedPrefixList. DescribeManagedPrefixLists. DescribePrefixLists."
AWS \ Amazon EC2 \ API Reference \ Actions by service \ Amazon VPC actions,https://docs.aws.amazon.com/AWSEC2/latest/APIReference/OperationList-query-vpc.html,GetManagedPrefixListAssociations. GetManagedPrefixListEntries. ModifyManagedPrefixList. RestoreManagedPrefixListVersion. CreateNatGateway. DeleteNatGateway. DescribeNatGateways. CreateNetworkAcl. CreateNetworkAclEntry. DeleteNetworkAcl. DeleteNetworkAclEntry. DescribeNetworkAcls. ReplaceNetworkAclAssociation. ReplaceNetworkAclEntry. AssociateRouteTable. CreateRoute. CreateRouteTable. DeleteRoute. DeleteRouteTable. DescribeRouteTables. DisassociateRouteTable. ReplaceRoute. ReplaceRouteTableAssociation. AuthorizeSecurityGroupEgress. AuthorizeSecurityGroupIngress. CreateSecurityGroup. DeleteSecurityGroup. DescribeSecurityGroupReferences. DescribeSecurityGroups. DescribeStaleSecurityGroups. ModifySecurityGroupRules. RevokeSecurityGroupEgress. RevokeSecurityGroupIngress. UpdateSecurityGroupRuleDescriptionsEgress. UpdateSecurityGroupRuleDescriptionsIngress. AssociateSubnetCidrBlock. CreateDefaultSubnet. CreateSubnet.
AWS \ Amazon EC2 \ API Reference \ Actions by service \ Amazon VPC actions,https://docs.aws.amazon.com/AWSEC2/latest/APIReference/OperationList-query-vpc.html,CreateSubnetCidrReservation. DeleteSubnet. DeleteSubnetCidrReservation. DescribeSubnets. DisassociateSubnetCidrBlock. GetSubnetCidrReservations. ModifySubnetAttribute. CreateTrafficMirrorFilter. CreateTrafficMirrorFilterRule. CreateTrafficMirrorSession. CreateTrafficMirrorTarget. DeleteTrafficMirrorFilter. DeleteTrafficMirrorFilterRule. DeleteTrafficMirrorSession. DeleteTrafficMirrorTarget. DescribeTrafficMirrorFilters. DescribeTrafficMirrorSessions. DescribeTrafficMirrorTargets. ModifyTrafficMirrorFilterNetworkServices. ModifyTrafficMirrorFilterRule. ModifyTrafficMirrorSession. AssociateVpcCidrBlock. CreateDefaultVpc. CreateVpc. DeleteVpc. DescribeVpcAttribute. DescribeVpcs. DisassociateVpcCidrBlock. ModifyVpcAttribute. ModifyVpcTenancy. CreateFlowLogs. DeleteFlowLogs. DescribeFlowLogs. GetFlowLogsIntegrationTemplate. AcceptVpcPeeringConnection.CreateVpcPeeringConnection. DeleteVpcPeeringConnection. DescribeVpcPeeringConnections. ModifyVpcPeeringConnectionOptions. RejectVpcPeeringConnection.
Choosing an AWS machine learning service,https://aws.amazon.com/getting-started/decision-guides/machine-learning-on-aws-how-to-choose/,"^^^Choosing an AWS machine learning service^^^ ^Pick the right AI and ML services, frameworks, and foundation models to support your work^ ^^Introduction^^ 25 minutes. At its most basic, machine learning (ML) is designed to provide digital tools and services to learn from data, identify patterns, make predictions, and then act on those predictions. Almost all artificial intelligence (AI) systems today are created using ML. ML uses large amounts of data to create and validate decision logic. This decision logic forms the basis of the AI ""model"".

A fast-growing subset of machine learning is generative AI, which is powered by large models that are pretrained on a vast set of data - commonly referred to as foundation models (FMs) AWS services based on generative AI include: Help determine which AWS ML services are the best fit for your needs. Beginner. July 26, 2023"
Choosing an AWS machine learning service,https://aws.amazon.com/getting-started/decision-guides/machine-learning-on-aws-how-to-choose/,"Amazon Bedrock
Amazon CodeWhisperer
Amazon Comprehend
Amazon Textract
Amazon Translate
Amazon Lex
Amazon Polly
Amazon Transcribe
Amazon Rekognition
Amazon SageMaker. This decision guide will help you ask the right questions, evaluate your criteria, and determine which services are the best fit for your needs. Analytics
Application integration
Containers
Databases
Development strategy
Storage. In less than two minutes, Dr. Werner Vogels, Amazon CTO explains how generative AI works and how you might use it. This video is part of a longer discussion between Dr. Vogels and Swami Sivasubramanian, AWS vice-president of database, analytics, and ML, about the broad landscape of generative AI, why it’s not hype, and how AWS is democratizing access to large language and foundation models. ^^Understand^^ ^^Consider^^ When solving a business problem with AWS ML services, consideration of several key criteria can help ensure success."
