page_title,page_url,content
AWS \ Amazon Simple Storage Service (S3) \ User Guide \ What is Amazon S3?,https://docs.aws.amazon.com/AmazonS3/latest/userguide/index.html,"The AWS CLI is supported on Windows, macOS, and Linux. To get started, see the AWS Command Line Interface User Guide. For more information about the commands for Amazon S3, see s3api and s3control in the AWS CLI Command Reference. ^AWS SDKs^ AWS provides SDKs (software development kits) that consist of libraries and sample code for various programming languages and platforms (Java, Python, Ruby, .NET, iOS, Android, and so on) The AWS SDKs provide a convenient way to create programmatic access to S3 and AWS. Amazon S3 is a REST service. You can send requests to Amazon S3 using the AWS SDK libraries, which wrap the underlying Amazon S3 REST API and simplify your programming tasks. For example, the SDKs take care of tasks such as calculating signatures, cryptographically signing requests, managing errors, and retrying requests automatically."
AWS \ Amazon Simple Storage Service (S3) \ User Guide \ What is Amazon S3?,https://docs.aws.amazon.com/AmazonS3/latest/userguide/index.html,"For information about the AWS SDKs, including how to download and install them, see Tools for AWS. Every interaction with Amazon S3 is either authenticated or anonymous. If you are using the AWS SDKs, the libraries compute the signature for authentication from the keys that you provide. For more information about how to make requests to Amazon S3, see Making requests. ^Amazon S3 REST API^ The architecture of Amazon S3 is designed to be programming language-neutral, using AWS-supported interfaces to store and retrieve objects. You can access S3 and AWS programmatically by using the Amazon S3 REST API. The REST API is an HTTP interface to Amazon S3 With the REST API, you use standard HTTP requests to create, fetch, and delete buckets and objects. To use the REST API, you can use any toolkit that supports HTTP. You can even use a browser to fetch objects, as long as they are anonymously readable."
AWS \ Amazon Simple Storage Service (S3) \ User Guide \ What is Amazon S3?,https://docs.aws.amazon.com/AmazonS3/latest/userguide/index.html,"The REST API uses standard HTTP headers and status codes, so that standard browsers and toolkits work as expected. In some areas, we have added functionality to HTTP (for example, we added headers to support access control) In these cases, we have done our best to add the new functionality in a way that matches the style of standard HTTP usage. If you make direct REST API calls in your application, you must write the code to compute the signature and add it to the request. For more information about how to make requests to Amazon S3, see Making requests. SOAP API support over HTTP is deprecated, but it is still available over HTTPS. Newer Amazon S3 features are not supported for SOAP. We recommend that you use either the REST API or the AWS SDKs. ^^Paying for Amazon S3^^ Pricing for Amazon S3 is designed so that you don't have to plan for the storage requirements of your application."
AWS \ Amazon Simple Storage Service (S3) \ User Guide \ What is Amazon S3?,https://docs.aws.amazon.com/AmazonS3/latest/userguide/index.html,"Most storage providers require you to purchase a predetermined amount of storage and network transfer capacity. In this scenario, if you exceed that capacity, your service is shut off or you are charged high overage fees. If you do not exceed that capacity, you pay as though you used it all. Amazon S3 charges you only for what you actually use, with no hidden fees and no overage charges. This model gives you a variable-cost service that can grow with your business while giving you the cost advantages of the AWS infrastructure. For more information, see Amazon S3 Pricing. When you sign up for AWS, your AWS account is automatically signed up for all services in AWS, including Amazon S3 However, you are charged only for the services that you use. If you are a new Amazon S3 customer, you can get started with Amazon S3 for free. For more information, see AWS free tier."
AWS \ Amazon Simple Storage Service (S3) \ User Guide \ What is Amazon S3?,https://docs.aws.amazon.com/AmazonS3/latest/userguide/index.html,"To see your bill, go to the Billing and Cost Management Dashboard in the AWS Billing and Cost Management console. To learn more about AWS account billing, see the AWS Billing User Guide. If you have questions concerning AWS billing and AWS accounts, contact AWS Support. ^^PCI DSS compliance^^ Amazon S3 supports the processing, storage, and transmission of credit card data by a merchant or service provider, and has been validated as being compliant with Payment Card Industry (PCI) Data Security Standard (DSS) For more information about PCI DSS, including how to request a copy of the AWS PCI Compliance Package, see PCI DSS Level 1."
AWS \ Amazon Simple Storage Service (S3) \ API Reference \ Amazon S3 REST API Introduction,https://docs.aws.amazon.com/AmazonS3/latest/API/Welcome.html,"^^^Amazon S3 REST API Introduction^^^ Welcome to the Amazon Simple Storage Service API Reference. This guide explains the Amazon Simple Storage Service (Amazon S3) application programming interface (API) It describes various API operations, related request and response structures, and error codes. The current version of the Amazon S3 API is 2006-03-01 Amazon S3 supports the REST API. Support for SOAP over HTTP is deprecated, but it is still available over HTTPS. However, new Amazon S3 features will not be supported for SOAP. We recommend that you use either the REST API or the AWS SDKs. Read the following about authentication and access control before going to specific API topics. Requests to Amazon S3 can be authenticated or anonymous. Authenticated access requires credentials that AWS can use to authenticate your requests. When making REST API calls directly from your code, you create a signature using valid credentials and include the signature in your request."
AWS \ Amazon Simple Storage Service (S3) \ API Reference \ Amazon S3 REST API Introduction,https://docs.aws.amazon.com/AmazonS3/latest/API/Welcome.html,"For information about various authentication methods and signature calculations, see Authenticating Requests (AWS Signature Version 4) Making REST API calls directly from your code can be cumbersome. It requires you to write the necessary code to calculate a valid signature to authenticate your requests. We recommend the following alternatives instead: Use the AWS SDKs to send your requests (see Sample Code and Libraries) With this option, you don't need to write code to calculate a signature for request authentication because the SDK clients authenticate your requests by using access keys that you provide. Unless you have a good reason not to, you should always use the AWS SDKs. Use the AWS CLI to make Amazon S3 API calls. For information about setting up the AWS CLI and example Amazon S3 commands see the following topics: Set Up the AWS CLI in the Amazon Simple Storage Service User Guide. Using Amazon S3 with the AWS Command Line Interface in the AWS Command Line Interface User Guide."
AWS \ Amazon Simple Storage Service (S3) \ API Reference \ Amazon S3 REST API Introduction,https://docs.aws.amazon.com/AmazonS3/latest/API/Welcome.html,"If you'd like to make your own REST API calls instead of using one of the above alternatives, there are some things to keep in mind. The REST API uses standard HTTP headers and status codes, so standard browsers and toolkits work as expected. In some areas, we have added functionality to HTTP (for example, we added headers to support access control) In these cases, we have done our best to add the new functionality in a way that matches the style of standard HTTP usage. For more information about making requests, see Making requests in the Amazon Simple Storage Service User Guide. For additional details about developing using REST APIs, see Developing with Amazon S3 using the REST API in the Amazon Simple Storage Service User Guide. You can have valid credentials to authenticate your requests, but unless you have permissions you cannot create or access Amazon S3 resources. For example, you must have permissions to create an S3 bucket or get an object from your bucket."
AWS \ Amazon Simple Storage Service (S3) \ API Reference \ Amazon S3 REST API Introduction,https://docs.aws.amazon.com/AmazonS3/latest/API/Welcome.html,"If you use the root user credentials of your AWS account, you have all the permissions. However, using root user credentials is not recommended. Instead, we recommend that you create IAM roles in your account and manage user permissions. For more information, see Managing Access Permissions to Your Amazon S3 Resources in the Amazon Simple Storage Service User Guide."
AWS \ Amazon DynamoDB \ Developer Guide \ What is Amazon DynamoDB?,https://docs.aws.amazon.com/amazondynamodb/latest/developerguide/index.html,"^^^What is Amazon DynamoDB?^^^ Amazon DynamoDB is a fully managed NoSQL database service that provides fast and predictable performance with seamless scalability. DynamoDB lets you offload the administrative burdens of operating and scaling a distributed database so that you don't have to worry about hardware provisioning, setup and configuration, replication, software patching, or cluster scaling. DynamoDB also offers encryption at rest, which eliminates the operational burden and complexity involved in protecting sensitive data. For more information, see DynamoDB encryption at rest. With DynamoDB, you can create database tables that can store and retrieve any amount of data and serve any level of request traffic. You can scale up or scale down your tables' throughput capacity without downtime or performance degradation. You can use the AWS Management Console to monitor resource utilization and performance metrics. DynamoDB provides on-demand backup capability. It allows you to create full backups of your tables for long-term retention and archival for regulatory compliance needs."
AWS \ Amazon DynamoDB \ Developer Guide \ What is Amazon DynamoDB?,https://docs.aws.amazon.com/amazondynamodb/latest/developerguide/index.html,"For more information, see Using On-Demand backup and restore for DynamoDB. You can create on-demand backups and enable point-in-time recovery for your Amazon DynamoDB tables. Point-in-time recovery helps protect your tables from accidental write or delete operations. With point-in-time recovery, you can restore a table to any point in time during the last 35 days. For more information, see Point-in-time recovery: How it works. DynamoDB allows you to delete expired items from tables automatically to help you reduce storage usage and the cost of storing data that is no longer relevant. For more information, see Expiring items by using DynamoDB Time to Live (TTL) ^^High availability and durability^^ DynamoDB automatically spreads the data and traffic for your tables over a sufficient number of servers to handle your throughput and storage requirements, while maintaining consistent and fast performance."
AWS \ Amazon DynamoDB \ Developer Guide \ What is Amazon DynamoDB?,https://docs.aws.amazon.com/amazondynamodb/latest/developerguide/index.html,"All of your data is stored on solid-state disks (SSDs) and is automatically replicated across multiple Availability Zones in an AWS Region, providing built-in high availability and data durability. You can use global tables to keep DynamoDB tables in sync across AWS Regions. For more information, see Global tables - multi-Region replication for DynamoDB. ^^Getting started with DynamoDB^^ We recommend that you begin by reading the following sections: Amazon DynamoDB: How it works—To learn essential DynamoDB concepts. Setting up DynamoDB —To learn how to set up DynamoDB (the downloadable version or the web service) Accessing DynamoDB—To learn how to access DynamoDB using the console, AWS CLI, or API. From there, you have two options to quickly get started quickly with DynamoDB: Getting started with DynamoDB. Getting started with DynamoDB and the AWS SDKs. To learn more about application development, see the following: Programming with DynamoDB and the AWS SDKs."
AWS \ Amazon DynamoDB \ Developer Guide \ What is Amazon DynamoDB?,https://docs.aws.amazon.com/amazondynamodb/latest/developerguide/index.html,"Working with tables, items, queries, scans, and indexes. To quickly find recommendations for maximizing performance and minimizing throughput costs, see the following: Best practices for designing and architecting with DynamoDB. To learn how to tag DynamoDB resources, see Adding tags and labels to resources. For best practices, how-to guides, and tools, see Amazon DynamoDB resources. You can use AWS Database Migration Service (AWS DMS) to migrate data from a relational database or MongoDB to a DynamoDB table. For more information, see the AWS Database Migration Service User Guide. To learn how to use MongoDB as a migration source, see Using MongoDB as a source for AWS Database Migration Service. To learn how to use DynamoDB as a migration target, see Using an Amazon DynamoDB database as a target for AWS Database Migration Service. ^^DynamoDB tutorials^^ The following tutorials present complete end-to-end procedures to familiarize yourself with DynamoDB.These tutorials can be completed with the free tier of AWS and will give you practical experience using DynamoDB. Build an Application Using a NoSQL Key-Value Data Store. Create and Query a NoSQL Table with Amazon DynamoDB."
AWS \ Amazon DynamoDB \ API Reference \ Welcome,https://docs.aws.amazon.com/amazondynamodb/latest/APIReference/index.html,"@@@^^^Welcome^^^@@@ Amazon DynamoDB provides low-level API actions for managing database tables and indexes, and for creating, reading, updating and deleting data. DynamoDB also provides API actions for accessing and processing stream records. This API Reference describes the low-level API for Amazon DynamoDB. Instead of making requests to the low-level API directly from your application, we recommend that you use one of the AWS Software Development Kits (SDKs) for your programming language. The AWS SDKs take care of request authentication, serialization, and connection management. For more information, see Overview of AWS SDK Support for DynamoDB in the Amazon DynamoDB Developer Guide. At the end of each API action description there are links to the equivalent CLI command and programming-specific language method. Similarly, at the end of each API datatype description, there are links to the equivalent programming-specific language type."
AWS \ Amazon DynamoDB \ Developer Guide \ What is Amazon DynamoDB? \ Amazon DynamoDB: How it works \ Cheat sheet for DynamoDB,https://docs.aws.amazon.com/amazondynamodb/latest/developerguide/CheatSheet.html,"^^^Cheat sheet for DynamoDB^^^ This cheat sheet provides a quick reference for working with Amazon DynamoDB and its various AWS SDKs. ^^Initial setup^^ Sign up for AWS. Get an AWS access key to access DynamoDB programmatically. Configure your DynamoDB credentials. See also: Setting up DynamoDB (web service) Getting started with DynamoDB. Basic overview of core components. ^^SDK or CLI^^ Choose your preferred SDK, or set up the AWS CLI. When you use the AWS CLI on Windows, a backslash (\) that is not inside a quote is treated as a carriage return. Also, you must escape any quotes and braces inside other quotes. For an example, see the Windows tab in ""Create a table"" in the next section. See also: AWS CLI with DynamoDB. Getting started with DynamoDB - step 2 ^^Basic actions^^ This section provides code for basic DynamoDB tasks."
AWS \ Amazon DynamoDB \ Developer Guide \ What is Amazon DynamoDB? \ Amazon DynamoDB: How it works \ Cheat sheet for DynamoDB,https://docs.aws.amazon.com/amazondynamodb/latest/developerguide/CheatSheet.html,"For more information about these tasks, see Getting started with DynamoDB and the AWS SDKs. ^Create a table^ ~~awsdynamodbcreate-table\--table-nameMusic\--attribute-definitions\AttributeName=Artist,AttributeType=S\AttributeName=SongTitle,AttributeType=S\--key-schema\AttributeName=Artist,KeyType=HASH\AttributeName=SongTitle,KeyType=RANGE\--provisioned-throughput\ReadCapacityUnits=10,WriteCapacityUnits=5~~ ^Write item to a table^ ~~awsdynamodbput-item\--table-nameMusic\--itemfile://item.json~~ ^Read item from a table^ ~~awsdynamodbget-item\--table-nameMusic\--itemfile://item.json~~ ^Delete item from a table^ ~~awsdynamodbdelete-item--table-nameMusic--keyfile://key.json~~ ^Query a table^"
AWS \ Amazon DynamoDB \ Developer Guide \ What is Amazon DynamoDB? \ Amazon DynamoDB: How it works \ Cheat sheet for DynamoDB,https://docs.aws.amazon.com/amazondynamodb/latest/developerguide/CheatSheet.html,"~~awsdynamodbquery--table-nameMusic--key-condition-expression""ArtistName=:ArtistandSongName=:Songtitle""~~ ^Delete a table^ ~~awsdynamodbdelete-table--table-nameMusic~~ ^List table names^ ~~awsdynamodblist-tables~~ ^^Naming rules^^ All names must be encoded using UTF-8 and are case sensitive. Table names and index names must be between 3 and 255 characters long, and can contain only the following characters: a-z. A-Z. 0-9 _(underscore) -(dash) .(dot) Attribute names must be at least one character long, and less than 64 KB in size. For more information, see Naming rules. ^^Service quota basics^^ Read and write units. Read capacity unit (RCU) – One strongly consistent read per second, or two eventually consistent reads per second, for items up to 4 KB in size."
AWS \ Amazon DynamoDB \ Developer Guide \ What is Amazon DynamoDB? \ Amazon DynamoDB: How it works \ Cheat sheet for DynamoDB,https://docs.aws.amazon.com/amazondynamodb/latest/developerguide/CheatSheet.html,"Write capacity unit (WCU) – One write per second, for items up to 1 KB in size. Table limits. Table size – There is no practical limit on table size. Tables are unconstrained in terms of the number of items or the number of bytes. Number of tables – For any AWS account, there is an initial quota of 2,500 tables per AWS Region. Page size limit for query and scan – There is a limit of 1 MB per page, per query or scan. If your query parameters or scan operation on a table result in more than 1 MB of data, DynamoDB returns the initial matching items. It also returns a LastEvaluatedKey property that you can use in a new request to read the next page. Indexes. Local secondary indexes (LSIs) – You can define a maximum of five local secondary indexes. LSIs are primarily useful when an index must have strong consistency with the base table."
AWS \ Amazon DynamoDB \ Developer Guide \ What is Amazon DynamoDB? \ Amazon DynamoDB: How it works \ Cheat sheet for DynamoDB,https://docs.aws.amazon.com/amazondynamodb/latest/developerguide/CheatSheet.html,"Global secondary indexes (GSIs) – There is a default quota of 20 global secondary indexes per table. Projected secondary index attributes per table – You can project a total of up to 100 attributes into all of a table's local and global secondary indexes. This only applies to user-specified projected attributes. Partition keys. The minimum length of a partition key value is 1 byte. The maximum length is 2048 bytes. There is no practical limit on the number of distinct partition key values, for tables or for secondary indexes. The minimum length of a sort key value is 1 byte. The maximum length is 1024 bytes. In general, there is no practical limit on the number of distinct sort key values per partition key value. The exception is for tables with secondary indexes. For more information on secondary indexes, partition key design, and sort key design, see Best practices. Limits for commonly used data types."
AWS \ Amazon DynamoDB \ Developer Guide \ What is Amazon DynamoDB? \ Amazon DynamoDB: How it works \ Cheat sheet for DynamoDB,https://docs.aws.amazon.com/amazondynamodb/latest/developerguide/CheatSheet.html,"String – The length of a string is constrained by the maximum item size of 400 KB. Strings are Unicode with UTF-8 binary encoding. Number – A number can have up to 38 digits of precision, and can be positive, negative, or zero. Binary – The length of a binary is constrained by the maximum item size of 400 KB. Applications that work with binary attributes must encode the data in base64 encoding before sending it to DynamoDB. For a full list of supported data types, see Data types. For more information, also see Service quotas. ^Items, attributes, and expression parameters^ The maximum item size in DynamoDB is 400 KB, which includes both attribute name binary length (UTF-8 length) and attribute value binary lengths (UTF-8 length) The attribute name counts towards the size limit."
AWS \ Amazon DynamoDB \ Developer Guide \ What is Amazon DynamoDB? \ Amazon DynamoDB: How it works \ Cheat sheet for DynamoDB,https://docs.aws.amazon.com/amazondynamodb/latest/developerguide/CheatSheet.html,"There is no limit on the number of values in a list, map, or set, as long as the item that contains the values fits within the 400-KB item size limit. For expression parameters, the maximum length of any expression string is 4 KB. For more information about item size, attributes, and expression parameters, see Service quotas. ^^More information^^ Security. Monitoring and logging. Working with streams. Backups and Point-in-time recovery. Integrating with other AWS services. API reference. Architecture Center: Database Best Practices. Video tutorials. DynamoDB forum."
AWS \ Amazon RDS \ User Guide \ What is Amazon Relational Database Service (Amazon RDS)?,https://docs.aws.amazon.com/AmazonRDS/latest/UserGuide/index.html,"^^^What is Amazon Relational Database Service (Amazon RDS)?^^^ Amazon Relational Database Service (Amazon RDS) is a web service that makes it easier to set up, operate, and scale a relational database in the AWS Cloud. It provides cost-efficient, resizable capacity for an industry-standard relational database and manages common database administration tasks. This guide covers Amazon RDS database engines other than Amazon Aurora. For information about using Amazon Aurora, see the Amazon Aurora User Guide. If you are new to AWS products and services, begin learning more with the following resources: For an overview of all AWS products, see What is cloud computing? Amazon Web Services provides a number of database services. To learn more about the variety of database options available on AWS, see Choosing an AWS database service and Running databases on AWS. ^^Overview of Amazon RDS^^"
AWS \ Amazon RDS \ User Guide \ What is Amazon Relational Database Service (Amazon RDS)?,https://docs.aws.amazon.com/AmazonRDS/latest/UserGuide/index.html,"Why do you want to run a relational database in the AWS Cloud? Because AWS takes over many of the difficult and tedious management tasks of a relational database. ^Amazon EC2 and on-premises databases^ Amazon Elastic Compute Cloud (Amazon EC2) provides scalable computing capacity in the AWS Cloud. Amazon EC2 eliminates your need to invest in hardware up front, so you can develop and deploy applications faster. When you buy an on-premises server, you get CPU, memory, storage, and IOPS, all bundled together. With Amazon EC2, these are split apart so that you can scale them independently. If you need more CPU, less IOPS, or more storage, you can easily allocate them. For a relational database in an on-premises server, you assume full responsibility for the server, operating system, and software. For a database on an Amazon EC2 instance, AWS manages the layers below the operating system."
AWS \ Amazon RDS \ User Guide \ What is Amazon Relational Database Service (Amazon RDS)?,https://docs.aws.amazon.com/AmazonRDS/latest/UserGuide/index.html,"In this way, Amazon EC2 eliminates some of the burden of managing an on-premises database server. In the following table, you can find a comparison of the management models for on-premises databases and Amazon EC2 Feature. On-premises management. Amazon EC2 management. Application optimization. Customer. Customer. Scaling. Customer. Customer. High availability. Customer. Customer. Database backups. Customer. Customer. Database software patching. Customer. Customer. Database software install. Customer. Customer. Amazon EC2 isn't a fully managed service. Thus, when you run a database on Amazon EC2, you're more prone to user errors. For example, when you update the operating system or database software manually, you might accidentally cause application downtime. You might spend hours checking every change to identify and fix an issue. Operating system (OS) patching. Customer. Customer. OS installation. Customer. Customer. Server maintenance. Customer. AWS."
AWS \ Amazon RDS \ User Guide \ What is Amazon Relational Database Service (Amazon RDS)?,https://docs.aws.amazon.com/AmazonRDS/latest/UserGuide/index.html,"^Amazon RDS and Amazon EC2^ Hardware lifecycle. Customer. AWS. Amazon RDS is a managed database service. It's responsible for most management tasks. By eliminating tedious manual tasks, Amazon RDS frees you to focus on your application and your users. We recommend Amazon RDS over Amazon EC2 as your default choice for most database deployments. Power, network, and cooling. Customer. AWS. In the following table, you can find a comparison of the management models in Amazon EC2 and Amazon RDS. Feature. Amazon EC2 management. Amazon RDS management. Application optimization. Customer. Customer. Scaling. Customer. AWS. High availability. Customer. AWS. Database backups. Customer. AWS. Database software patching. Customer. AWS. Database software install. Customer. AWS. Amazon RDS provides the following specific advantages over database deployments that aren't fully managed: OS patching. Customer. AWS. OS installation. Customer. AWS."
